,asin,helpful,overall,reviewText,reviewTime,reviewerID,reviewerName,summary,unixReviewTime
70,0000031887,"[0, 0]",5.0,"Bought this for my 7yr old niece and she absolutely loved it. It was poofy, and great quality. Has an elastic waistband which is nice as I decided to try on myself when we played with barbies lol!!!","07 18, 2013",A3VV6Q18NFUCSX,Brenda Rosales,Great quality,1374105600
71,0000031887,"[0, 0]",5.0,Absolutely beautiful costume.  Very soft and breezy!  My granddaughter loves it!  Super fast delivery!  Thanks!  Wouldn't hesitate ordering more!  Runs true to size,"02 13, 2013",AH3F12SYJ693R,Brian D. Leahy,Ballet Dress Up Fairty Tutu,1360713600
72,0000031887,"[0, 0]",5.0,"This was the skirt for my daughters halloween costume this year.  I have made lots of tutus, but this was so much easier and cheaper in the long run!  Also ordered orange!  A no-brainer.","12 21, 2013",ACR9ES55PCMHO,brwn_eyed_sue,Used for Halloween,1387584000
73,0000031887,"[0, 1]",4.0,Cute tutus.  Definitely dress up play item.  Which is what we were looking for.  My little one loves to wear them around the house.  Good product for the price.,"01 13, 2014",A1D7AK2ZV16V2X,Busy Mama,Tutu,1389571200
74,0000031887,"[1, 2]",4.0,"I was slightly worried about it fitting, but the elastic in it works well. I am a 28 year old, wear anywhere from 5-9 size jeans (depending on the brand), and this tutu fit great. Wore it for a Costume Party Run Half Marathon (part of my Batman Costume) and it worked great. Wish it would have been a little fuller, but it did its job.","07 22, 2013",A2RV0NHF7ODWPX,Carlee,Fits a 28 year old,1374451200
75,0000031887,"[0, 0]",5.0,My daughter and a friend were dressing up for Halloween as a 80's rock star.  This tutu worked perfectly.  It arrived very quickly and was just what we needed to finish off their outfits.,"11 24, 2012",AIYL9P9I7J5TG,Carmen Sorenson,Tutu for a rock star,1353715200
76,0000031887,"[0, 0]",5.0,"What can I say... my daughters have it in orange, black, white and pink and I am thinking to buy for they the fuccia one. It is a very good way for exalt a dancer outfit: great colors, comfortable, looks great, easy to wear, durables and little girls love it. I think it is a great buy for costumer and play too.","01 4, 2013",A1RLQXYNCMWRWN,Carola,I have buy more than one,1357257600
77,0000031887,"[0, 0]",5.0,"We bought several tutus at once, and they are got high reviews. Sturdy and seemingly well-made. The girls have been wearing them regularly, including out to play, and the tutus have stood up well. Fits the 3-yr old & the 5-yr old well. Clearly plenty of room to grow. Only con is that when the kids pull off the tutus, the waste band gets twisted, and an adult has to un-tangle. But this is not difficult.","04 27, 2014",A8U3FAMSJVHS5,Caromcg,"Adorable, Sturdy",1398556800
78,0000031887,"[0, 0]",1.0,"My daughter wore this for two hours on Halloween, after just the one use it was falling apart.  Poor quality, I would not recommend.","11 16, 2013",A3TUTGXQP1X0SI,Casey Fennell,Poor Quality,1384560000
79,0000031887,"[0, 0]",5.0,It was exactly as described. Very happy with the product. .... .. .... ..... ..... .. ... .... .... ..,"01 17, 2013",AWL1LVO2QI6I2,Cathe,Perfect.,1358380800
80,0000031887,"[0, 0]",5.0,I purchased these for my grandchildren ages 6 & 3 for Christmas & they love them. They are well made & the colors are beautiful.,"01 12, 2014",A5T4F8B7XF3AU,Cathy Cervone,Beautiful & well made,1389484800
81,0000031887,"[0, 0]",2.0,This tutu is really long on my 40&#34; daughter. It doesn't pouf out much either. It's more like a see through skirt. The two layers of touille get twisted every time she takes it off and I have to fight with it to figure out which is right side out again. Pretty cheap construction.,"11 13, 2012",A2B62F0GQMUVY0,C Fisher,Ehhhh...,1352764800
82,0000031887,"[0, 0]",1.0,my 8 year old daughter wore this 1 time for a couple hours for a school play and it fell right apart. she was upset and so was i.,"02 7, 2014",A3F97HTSL814QD,Christy Gijanto,bad buy,1391731200
83,0000031887,"[0, 0]",5.0,"Thank you Halo Heaven great product for Little Girls.  My Great Grand Daughters Love these Tutu's.  Will buy more from this seller.  Made well and cute on the girls.  Thanks for a great product.NEVER BUY FROM DRESS UP DREAMS........I will buy more as long as I don't buy from &#34;Dress Up Dreams&#34;  I never rec'd or order in FL. Only rec'd pink, the purple one was missing.  Company is a rip off.  REFUSES to make good on purchase...... Real creeps.","03 15, 2014",A3GEOILWLK86XM,CJ,Grammy's Angels Love it,1394841600
84,0000031887,"[0, 0]",5.0,"This is a good length, works for an adult, looks cute on and will be fun to wear. Great buy!","03 28, 2013",A27PG9BXVRT7V8,Claudia H. Cosimano,Great cute skirt,1364428800
85,0000031887,"[0, 0]",4.0,"I received this today and I'm not a fan of it but my daughter is I thought it would be puffier as it looks in the pic but it's not and the one they sent me is pink underneath and the waist band is pink which is not what I wanted due to the fact she already had the sandals she was gonna wear with it now I gotta find another pair of sandals,ima just keep it cuz she likes it.","03 31, 2014",A27UF1MSF3DB2,"C-Lo ""Cynthia""",It's ok,1396224000
86,0000031887,"[0, 0]",5.0,"Bought this tutu for my 3.5yr old.  Fits her well around the waist, she's very happy.  Satin around the waist, other edges are unfinished.","09 11, 2012",A2EKHP38KG3ZV2,Colleen P Devine,cute,1347321600
87,0000031887,"[3, 3]",4.0,This tutu could be used for a kid...or a small adult--so it was perfect for me!  The waistband was decent quality and it worked great for my Halloween costume.,"11 26, 2012",A2RAGC7VLO78QG,Colonel Mustard,Great for kids or small people,1353888000
88,0000031887,"[0, 0]",3.0,"This tutu lasted for a few months, but then the elastic lost it's elasticity....For the price it was worth it though.","12 5, 2012",A154EV8GA9YI2V,CookieD,Lasted for a few months...,1354665600
89,0000031887,"[0, 0]",5.0,"It is a little big for my 2 year old, but she wears a 3t.  She is a big girl for her age.  It is a little long but fits good around her waist.  She likes to dress herself and she is not ""easy"" doing so.  I was worried she would have it ripped but so far she has not.  It has really held up to her ruffness.  Wish I bought other colors and still just might","12 3, 2012",APQHMWBFEZF2I,countrygrlsheila,Daughter loves it,1354492800
90,0000031887,"[0, 0]",5.0,"I bought this for a race I was doing.  I was a little nervous buying a costume item that is marketed in child sizes.  I'm 27, 112 lbs, 5'3&#34;.  The tutu worked out perfectly and its expandable waistband could easily have stretched even further.  I also cut it to make it a little shorter.  Overall, great buy for the price.","02 2, 2014",A1YDI7KVXKL5DG,Courtney Matis-Burnett,Great for dress-up,1391299200
91,0000031887,"[0, 0]",5.0,Highly recommended for basic little girls tutu. Great for kids who are still growing and might need a size change later on.,"01 4, 2014",A2EENASQDJAN1N,CP,so great and great price,1388793600
92,0000031887,"[20, 23]",5.0,"I looked all over amazon for a tutu, I wanted a nice full one. After much debate I decided to take my chances on this one, the price is great which also did actually worry me. I received it yesterday and it FAR exceeds my expectations, it's beautiful, LOVE IT. It's very full with 3 layers of tulle and a nice satin finished waistband. My daughter is 1 and has a tiny waist, I thought I would have to take it in when I got it but amazingly it fits her and she has PLENTY of room to grow in it as well. It is pretty long on her right now like a full length tutu but that makes it even prettier on her at this point. As she grows obviously it will become shorter, I can't believe I paid this price for such a cute tutu that she can have and grow into for a few years to come, fantastic. I didn't even have to iron it, it was packaged straight no crinkles.","02 8, 2011",A12OFS8WQP86O5,crelieu,Better than i expected,1297123200
93,0000031887,"[0, 0]",1.0,"what was sent to me is a royal blue tutu - not turquoise, turquoise has a touch of green to it.","05 13, 2014",A1LFDDL85CKP74,Danielle Morris,color mix-up!,1399939200
94,0000031887,"[0, 0]",3.0,"This was a one-size-fits-all toddlers skirt. My toddler niece is swimming in it. I don't mind because toddlers grow fast so I'm sure she'll be wearing it within a year or so. She loves tutus, so she'll wear it before then as well...it'll just be a large skirt...like a dress.","01 7, 2014",ATDL69N2MREWP,danijoy4,Cute but much larger than expected,1389052800
95,0000031887,"[0, 0]",5.0,I sent it to my granddaughter for her 4th birthday and she LOVED it!  Wore it around the house over her long pants.,"02 11, 2013",A2TWG16MB2V7VI,D. Doyle,my granddaughter loved it,1360540800
96,0000031887,"[0, 0]",5.0,Very nice for the price! Washed by hand and held up nicely. The quality is nice and my daugher loves it!,"12 10, 2013",A2DMMA8Q16GKM4,Debbie L Baranska,Very nice tutu,1386633600
97,0000031887,"[0, 0]",4.0,These were a good buy - great color and quality for the price. Bought them for a ballet themed party and girls loved them!,"06 12, 2013",A33CIS842YHGDM,Dec,"Good quality, good price...",1370995200
98,0000031887,"[0, 0]",5.0,"My daughter wore this at her first dance recital.  I wasn't expecting much since it was so cheap.  It is suprizingly soft, and the length was great.  She stood out from other girls that had homeade tutu's and I can't imagine that one could be made for cheaper than the $7 I paid for it.","07 12, 2013",AHUNCBKNI8HV8,DenverDiva,Perfect for her first recital,1373587200
99,0000031887,"[0, 0]",5.0,"Bought this as a backup to the regular ballet outfit my daughter has to wear. So far, she's using it to play out her Cinderella dreams but I am sure we'll be able to use it for a recital sometime soon. The quality is just fine for the price we paid. I was not expecting a designer skirt for this price and got exactly what I paid for.","05 3, 2014",A16GFPNVF4Y816,design maven,Great for dress-up and for ballet practice,1399075200
